{"id": "plate:FILE_NAME.jpg", "kind": "source", "domain": "other", "title": "Lighting/material plate: anonymous bearded man, hard key + coloured rim (describe the light, not the person)", "licence": "CC0-1.0", "licence_url": "https://creativecommons.org/publicdomain/zero/1.0/", "author": "Photographer as credited on the source page", "source_url": "https://example.invalid/page-of-the-photo", "download_url": "https://example.invalid/the-file-as-downloaded.jpg", "retrieved_or_built": "2026-01-01", "bytes": 0, "sha256": "0000000000000000000000000000000000000000000000000000000000000000", "status": "pending", "status_reason": "Blind plate test only (bench/m1/plates.py, checkpoint-3 §3.2): a lighting/material comparison tile, never a face or form target, never an input of any fitting or measuring step, not the actor. File kept locally in bench/ref/plates/ (gitignored), never committed. Set status to accepted after checking the licence on the source page."}
